{
  "$schema": "https://json-schema.org/draft/2020-12/schema",
  "title": "Portable task identity",
  "type": "object",
  "required": ["schema_version", "task_id", "project", "goal", "site", "baseline_commit", "created_at"],
  "properties": {
    "schema_version": {"const": 1},
    "task_id": {"type": "string", "pattern": "^[a-z0-9][a-z0-9_-]{0,63}$"},
    "project": {"type": "string", "minLength": 1},
    "goal": {"type": "string", "minLength": 1},
    "site": {"type": "string", "minLength": 1},
    "baseline_commit": {"type": "string", "minLength": 1},
    "created_at": {"type": "string", "format": "date-time"}
  }
}
