{
  "schema_version": 1,
  "task_id": "bto-long-nvt",
  "project": "eels-script",
  "goal": "Run 10 ps equilibration and 405 ps NVT production in restartable Arrhenius segments",
  "site": "arrhenius",
  "baseline_commit": "9915cd8723da8975fdf2e935c67aabe63431e443",
  "created_at": "2026-10-21T21:13:16.403192+00:00"
}
